lightllm/common/triton_utils/autotune_kernel_configs/triton_3.5.1/NVIDIA_H200/silu_and_mul_fwd:v1/{N=128,out_dtype=torch.bfloat16}_NVIDIA_H200.json
{
  "10": {
    "BLOCK_M": 1,
    "BLOCK_N": 64,
    "NUM_STAGES": 4,
    "num_warps": 8
  },
  "1000": {
    "BLOCK_M": 1,
    "BLOCK_N": 256,
    "NUM_STAGES": 1,
    "num_warps": 1
  },
  "10240": {
    "BLOCK_M": 8,
    "BLOCK_N": 128,
    "NUM_STAGES": 4,
    "num_warps": 1
  },
  "1280": {
    "BLOCK_M": 1,
    "BLOCK_N": 128,
    "NUM_STAGES": 2,
    "num_warps": 4
  },
  "160": {
    "BLOCK_M": 1,
    "BLOCK_N": 256,
    "NUM_STAGES": 1,
    "num_warps": 1
  },
  "163840": {
    "BLOCK_M": 64,
    "BLOCK_N": 128,
    "NUM_STAGES": 4,
    "num_warps": 1
  },
  "20480": {
    "BLOCK_M": 8,
    "BLOCK_N": 128,
    "NUM_STAGES": 4,
    "num_warps": 1
  },
  "2560": {
    "BLOCK_M": 8,
    "BLOCK_N": 64,
    "NUM_STAGES": 4,
    "num_warps": 1
  },
  "320": {
    "BLOCK_M": 1,
    "BLOCK_N": 256,
    "NUM_STAGES": 1,
    "num_warps": 1
  },
  "40960": {
    "BLOCK_M": 1,
    "BLOCK_N": 128,
    "NUM_STAGES": 4,
    "num_warps": 1
  },
  "640": {
    "BLOCK_M": 1,
    "BLOCK_N": 256,
    "NUM_STAGES": 1,
    "num_warps": 1
  },
  "80": {
    "BLOCK_M": 1,
    "BLOCK_N": 128,
    "NUM_STAGES": 4,
    "num_warps": 4
  }
}