lightllm/common/triton_utils/autotune_kernel_configs/triton_3.5.1/NVIDIA_A800-SXM4-80GB/_fwd_kernel_mtp_diverse_stage2_single_token:v2/{block_n=64,out_dtype=torch.float16,q_head_dim=128}_NVIDIA_A800-SXM4-80GB.json
{
  "1000000128": {
    "num_stages": 1,
    "num_warps": 4
  },
  "128000000032": {
    "num_stages": 1,
    "num_warps": 4
  },
  "16000000128": {
    "num_stages": 1,
    "num_warps": 4
  },
  "32000000064": {
    "num_stages": 1,
    "num_warps": 4
  },
  "64000000064": {
    "num_stages": 1,
    "num_warps": 4
  },
  "8000000128": {
    "num_stages": 1,
    "num_warps": 4
  }
}