lightllm/common/triton_utils/autotune_kernel_configs/triton_3.5.1/NVIDIA_H200/gated_rmsnorm_forward:v1/{N=128,has_bias=false,weight_dtype=torch.bfloat16,x_dtype=torch.bfloat16}_NVIDIA_H200.json
{
  "1024": {
    "BLOCK_N": 128,
    "num_warps": 1
  },
  "128": {
    "BLOCK_N": 512,
    "num_warps": 2
  },
  "131072": {
    "BLOCK_N": 128,
    "num_warps": 1
  },
  "1536": {
    "BLOCK_N": 128,
    "num_warps": 1
  },
  "16": {
    "BLOCK_N": 256,
    "num_warps": 4
  },
  "1600": {
    "BLOCK_N": 128,
    "num_warps": 1
  },
  "16384": {
    "BLOCK_N": 128,
    "num_warps": 1
  },
  "192": {
    "BLOCK_N": 128,
    "num_warps": 1
  },
  "2048": {
    "BLOCK_N": 64,
    "num_warps": 2
  },
  "24": {
    "BLOCK_N": 128,
    "num_warps": 1
  },
  "2400": {
    "BLOCK_N": 128,
    "num_warps": 1
  },
  "24576": {
    "BLOCK_N": 128,
    "num_warps": 1
  },
  "256": {
    "BLOCK_N": 512,
    "num_warps": 2
  },
  "262144": {
    "BLOCK_N": 128,
    "num_warps": 1
  },
  "3072": {
    "BLOCK_N": 128,
    "num_warps": 1
  },
  "32768": {
    "BLOCK_N": 128,
    "num_warps": 1
  },
  "384": {
    "BLOCK_N": 128,
    "num_warps": 1
  },
  "393216": {
    "BLOCK_N": 128,
    "num_warps": 1
  },
  "4096": {
    "BLOCK_N": 64,
    "num_warps": 2
  },
  "49152": {
    "BLOCK_N": 128,
    "num_warps": 1
  },
  "512": {
    "BLOCK_N": 256,
    "num_warps": 4
  },
  "6144": {
    "BLOCK_N": 128,
    "num_warps": 1
  },
  "64": {
    "BLOCK_N": 64,
    "num_warps": 2
  },
  "65536": {
    "BLOCK_N": 128,
    "num_warps": 1
  },
  "768": {
    "BLOCK_N": 256,
    "num_warps": 2
  },
  "8": {
    "BLOCK_N": 64,
    "num_warps": 2
  },
  "800": {
    "BLOCK_N": 64,
    "num_warps": 2
  },
  "8192": {
    "BLOCK_N": 128,
    "num_warps": 2
  },
  "98304": {
    "BLOCK_N": 128,
    "num_warps": 1
  }
}