lightllm/common/triton_utils/autotune_kernel_configs/triton_3.6.0/NVIDIA_GeForce_RTX_5090/moe_sum_reduce:v1/{hidden_dim=2048,out_dtype=torch.float16,topk_num=8}_NVIDIA_GeForce_RTX_5090.json
{
  "1": {
    "BLOCK_DIM": 128,
    "BLOCK_M": 16,
    "NUM_STAGE": 1,
    "num_warps": 1
  },
  "100": {
    "BLOCK_DIM": 512,
    "BLOCK_M": 1,
    "NUM_STAGE": 2,
    "num_warps": 16
  },
  "1024": {
    "BLOCK_DIM": 256,
    "BLOCK_M": 1,
    "NUM_STAGE": 1,
    "num_warps": 1
  },
  "128": {
    "BLOCK_DIM": 256,
    "BLOCK_M": 1,
    "NUM_STAGE": 1,
    "num_warps": 1
  },
  "16": {
    "BLOCK_DIM": 256,
    "BLOCK_M": 1,
    "NUM_STAGE": 2,
    "num_warps": 16
  },
  "2048": {
    "BLOCK_DIM": 512,
    "BLOCK_M": 1,
    "NUM_STAGE": 1,
    "num_warps": 8
  },
  "256": {
    "BLOCK_DIM": 512,
    "BLOCK_M": 1,
    "NUM_STAGE": 1,
    "num_warps": 2
  },
  "32": {
    "BLOCK_DIM": 256,
    "BLOCK_M": 1,
    "NUM_STAGE": 1,
    "num_warps": 1
  },
  "64": {
    "BLOCK_DIM": 512,
    "BLOCK_M": 1,
    "NUM_STAGE": 1,
    "num_warps": 8
  },
  "8": {
    "BLOCK_DIM": 256,
    "BLOCK_M": 1,
    "NUM_STAGE": 2,
    "num_warps": 16
  }
}