lightllm/common/triton_utils/autotune_kernel_configs/triton_3.5.1/NVIDIA_H200/grouped_matmul:v1/{K=2048,N=512,expert_num=256,mul_routed_weight=false,out_dtype=torch.bfloat16,topk_num=8,use_fp8_w8a8=false}_NVIDIA_H200.json
{
  "1024": {
    "BLOCK_SIZE_K": 64,
    "BLOCK_SIZE_M": 64,
    "BLOCK_SIZE_N": 128,
    "GROUP_SIZE_M": 32,
    "NEED_TRANS": false,
    "num_stages": 3,
    "num_warps": 4
  },
  "16384": {
    "BLOCK_SIZE_K": 64,
    "BLOCK_SIZE_M": 128,
    "BLOCK_SIZE_N": 128,
    "GROUP_SIZE_M": 1,
    "NEED_TRANS": false,
    "num_stages": 3,
    "num_warps": 4
  },
  "2048": {
    "BLOCK_SIZE_K": 64,
    "BLOCK_SIZE_M": 128,
    "BLOCK_SIZE_N": 128,
    "GROUP_SIZE_M": 1,
    "NEED_TRANS": false,
    "num_stages": 3,
    "num_warps": 8
  },
  "4096": {
    "BLOCK_SIZE_K": 64,
    "BLOCK_SIZE_M": 128,
    "BLOCK_SIZE_N": 128,
    "GROUP_SIZE_M": 1,
    "NEED_TRANS": false,
    "num_stages": 3,
    "num_warps": 4
  }
}