lightllm/common/triton_utils/autotune_kernel_configs/triton_3.5.1/NVIDIA_H200/mrope_triton_fused:v1/{HEAD_DIM=64,K_HEAD_NUM=1,Q_HEAD_NUM=8,dtype=torch.bfloat16}_NVIDIA_H200.json
{
  "1024": {
    "num_stages": 5,
    "num_warps": 1
  },
  "16384": {
    "num_stages": 4,
    "num_warps": 2
  },
  "2048": {
    "num_stages": 2,
    "num_warps": 2
  },
  "4096": {
    "num_stages": 3,
    "num_warps": 2
  }
}