lightllm/common/triton_utils/autotune_kernel_configs/triton_3.5.1/NVIDIA_H200/mrope_triton_fused:v1/{HEAD_DIM=64,K_HEAD_NUM=2,Q_HEAD_NUM=12,dtype=torch.bfloat16}_NVIDIA_H200.json
{
  "1": {
    "num_stages": 3,
    "num_warps": 4
  },
  "100": {
    "num_stages": 2,
    "num_warps": 1
  },
  "1024": {
    "num_stages": 2,
    "num_warps": 1
  },
  "128": {
    "num_stages": 5,
    "num_warps": 2
  },
  "16": {
    "num_stages": 3,
    "num_warps": 2
  },
  "16384": {
    "num_stages": 3,
    "num_warps": 1
  },
  "2048": {
    "num_stages": 5,
    "num_warps": 2
  },
  "256": {
    "num_stages": 3,
    "num_warps": 2
  },
  "32": {
    "num_stages": 3,
    "num_warps": 1
  },
  "4096": {
    "num_stages": 3,
    "num_warps": 4
  },
  "64": {
    "num_stages": 3,
    "num_warps": 4
  },
  "8": {
    "num_stages": 3,
    "num_warps": 1
  }
}