lightllm/common/triton_utils/autotune_kernel_configs/triton_3.6.0/NVIDIA_GeForce_RTX_5090/mrope_triton_fused:v1/{HEAD_DIM=128,K_HEAD_NUM=1,Q_HEAD_NUM=8,dtype=torch.float16}_NVIDIA_GeForce_RTX_5090.json
{
  "1": {
    "num_stages": 1,
    "num_warps": 1
  },
  "100": {
    "num_stages": 2,
    "num_warps": 1
  },
  "1024": {
    "num_stages": 5,
    "num_warps": 2
  },
  "128": {
    "num_stages": 4,
    "num_warps": 1
  },
  "16": {
    "num_stages": 1,
    "num_warps": 1
  },
  "2048": {
    "num_stages": 4,
    "num_warps": 1
  },
  "256": {
    "num_stages": 2,
    "num_warps": 4
  },
  "32": {
    "num_stages": 5,
    "num_warps": 1
  },
  "64": {
    "num_stages": 5,
    "num_warps": 1
  },
  "8": {
    "num_stages": 1,
    "num_warps": 1
  }
}